{
  "id": "l-core-48da2969-check-1",
  "schemaVersion": "v2",
  "kind": "public",
  "prompt": "What is the best use of this lesson for IMPLEMENTING-DATA-ENGINEERING-SOLUTIONS-USING-AZURE-DATABRICKS preparation?",
  "choices": [
    "Understand role scope and core objectives first",
    "Memorize implementation details without context",
    "Skip product and scenario alignment"
  ]
}
