{
  "id": "ai901-l-67ed16ba-check-1",
  "schemaVersion": "v2",
  "kind": "public",
  "prompt": "Dans une application Foundry, où faut-il placer les règles permanentes comme le rôle, le ton et les limites de l'assistant ?",
  "choices": [
    "Dans chaque prompt utilisateur uniquement",
    "Dans le nom du groupe de ressources",
    "Dans le prompt système",
    "Dans le paramètre de taille d'image"
  ]
}
