{
  "id": "dp900-l-azure-synapse-check-1",
  "schemaVersion": "v2",
  "kind": "public",
  "prompt": "Quel service Azure unifie l'entreposage de données et le big data en combinant pools SQL, moteur Spark et pipelines d'intégration ?",
  "choices": [
    "Azure SQL Database",
    "Azure Cosmos DB",
    "Azure Synapse Analytics",
    "Azure Blob Storage"
  ]
}
