{
  "id": "dp900-l-data-visualization-check-1",
  "schemaVersion": "v2",
  "kind": "public",
  "prompt": "Quel outil Microsoft permet de créer des rapports et tableaux de bord interactifs à partir de données analytiques ?",
  "choices": [
    "Power BI",
    "Azure Cosmos DB",
    "Azure Data Factory",
    "Azure Blob Storage"
  ]
}
