{
  "id": "ai901-l-a702cd9f-check-1",
  "schemaVersion": "v2",
  "kind": "public",
  "prompt": "Une équipe compare le taux d'acceptation d'un modèle de présélection entre plusieurs groupes et corrige les écarts injustifiés. Quel principe d'IA responsable applique-t-elle principalement ?",
  "choices": [
    "Transparence",
    "Fiabilité et sécurité",
    "Équité",
    "Responsabilité"
  ]
}
