{
  "id": "ai901-l-604cc02a-check-1",
  "schemaVersion": "v2",
  "kind": "public",
  "prompt": "Dans le portail Microsoft Foundry, quelle séquence permet de tester un modèle pour une application avant d'écrire le client ?",
  "choices": [
    "Choisir un modèle, créer un déploiement, puis l'essayer dans le playground",
    "Créer un agent sans modèle, puis supprimer le projet",
    "Exporter le modèle vers un fichier CSV, puis ouvrir Azure Monitor",
    "Créer un index de recherche, désactiver le point de terminaison du modèle, puis tester les documents indexés"
  ]
}
