{
  "id": "l-core-36bfed24-check-1",
  "schemaVersion": "v2",
  "kind": "public",
  "prompt": "What is the best use of this lesson for SECURITY-OPERATIONS-ANALYST preparation?",
  "choices": [
    "Understand role scope and core objectives first",
    "Memorize implementation details without context",
    "Skip product and scenario alignment"
  ]
}
