{
  "id": "l-core-1ae7270b-check-1",
  "schemaVersion": "v2",
  "kind": "public",
  "prompt": "What is the best use of this lesson for AZURE-AI-CLOUD-DEVELOPER-ASSOCIATE preparation?",
  "choices": [
    "Understand role scope and core objectives first",
    "Memorize implementation details without context",
    "Skip product and scenario alignment"
  ]
}
