{
  "id": "dp900-l-data-analyst-responsibilities-check-1",
  "schemaVersion": "v2",
  "kind": "public",
  "prompt": "Une personne prépare un modèle métier, définit des indicateurs puis crée un rapport Power BI pour aider les responsables à décider. Quel rôle remplit-elle principalement ?",
  "choices": [
    "Administrateur de base de données",
    "Ingénieur de données",
    "Administrateur réseau",
    "Analyste de données"
  ]
}
