{
  "id": "l-core-ee4871fc-check-1",
  "schemaVersion": "v2",
  "kind": "public",
  "prompt": "What is the best use of this lesson for D365-SALES-AI-CONSULTANT-ASSOCIATE preparation?",
  "choices": [
    "Understand role scope and core objectives first",
    "Memorize implementation details without context",
    "Skip product and scenario alignment"
  ]
}
