{
  "id": "az900-l-service-health-check-1",
  "schemaVersion": "v2",
  "kind": "public",
  "prompt": "Un administrateur veut connaître les incidents Azure et maintenances planifiées qui concernent spécifiquement ses abonnements et ses régions. Quel outil consulter ?",
  "choices": [
    "Azure Service Health",
    "Azure Advisor",
    "Microsoft Purview",
    "Azure Pricing Calculator"
  ]
}
