{
  "id": "az900-l-compute-options-check-1",
  "schemaVersion": "v2",
  "kind": "public",
  "prompt": "Vous devez exécuter une petite fonction uniquement quand un fichier est déposé, et ne payer que le temps d'exécution. Quel service Azure ?",
  "choices": [
    "Azure Functions",
    "Machine virtuelle",
    "Azure ExpressRoute",
    "Azure Blob Storage"
  ]
}
