{
  "id": "dp900-l-database-view-check-1",
  "schemaVersion": "v2",
  "kind": "public",
  "prompt": "Quel objet de base de données présente le résultat d'une requête enregistrée comme une table virtuelle, sans stocker nécessairement une copie des lignes ?",
  "choices": [
    "Une clé primaire",
    "Un index",
    "Une vue",
    "Une procédure de sauvegarde"
  ]
}
