{
  "id": "l-core-5624755d-check-1",
  "schemaVersion": "v2",
  "kind": "public",
  "prompt": "What is the best use of this lesson for GITHUB-ACTIONS preparation?",
  "choices": [
    "Understand role scope and core objectives first",
    "Memorize implementation details without context",
    "Skip product and scenario alignment"
  ]
}
