{
  "id": "az104-l-virtual-machines-check-1",
  "schemaVersion": "v2",
  "kind": "public",
  "prompt": "Sur quelle affirmation concernant le disque temporaire (temporary disk) d'une VM Azure peut-on compter ?",
  "choices": [
    "Il est répliqué en géo-redondance par défaut",
    "Son contenu peut être perdu lors d'une désallocation de la VM",
    "Il est idéal pour stocker une base de données de production",
    "Il est chiffré uniquement avec Ultra Disk"
  ]
}
