{
  "id": "az900-l-rbac-check-1",
  "schemaVersion": "v2",
  "kind": "public",
  "prompt": "Entra ID prouve l'identité d'un utilisateur. Qu'est-ce qui détermine ensuite les actions qu'il a le droit d'effectuer sur une ressource ?",
  "choices": [
    "Le RBAC (attribution de rôle : principal, rôle, portée)",
    "Le tag de la ressource",
    "La région de la ressource",
    "La Pricing Calculator"
  ]
}
