{
  "id": "l-core-0b60083e-check-1",
  "schemaVersion": "v2",
  "kind": "public",
  "prompt": "What is the best use of this lesson for MOS-EXCEL-FOR-ACCOUNTING-ASSOCIATE preparation?",
  "choices": [
    "Understand role scope and core objectives first",
    "Memorize implementation details without context",
    "Skip product and scenario alignment"
  ]
}
