{
  "id": "az900-l-shared-responsibility-check-1",
  "schemaVersion": "v2",
  "kind": "public",
  "prompt": "Vous utilisez Azure SQL Database (PaaS). Quelle responsabilité reste TOUJOURS la vôtre, quel que soit le modèle de service ?",
  "choices": [
    "Les correctifs du système d'exploitation hôte",
    "La sécurité physique du datacenter",
    "La gestion des données et des identités d'accès",
    "La maintenance du matériel réseau"
  ]
}