{
  "id": "ai900-l-azure-language-service-check-1",
  "schemaVersion": "v2",
  "kind": "public",
  "prompt": "Quel outil Foundry Tools fournit notamment la détection de langue, la reconnaissance d'entités nommées et la détection d'informations personnelles dans du texte ?",
  "choices": [
    "Azure Language",
    "Azure Speech",
    "Azure Face",
    "Azure Vision"
  ]
}
