{
  "id": "az900-l-networking-basics-check-1",
  "schemaVersion": "v2",
  "kind": "public",
  "prompt": "Une entreprise veut relier son datacenter à Azure via une liaison privée dédiée, sans emprunter l'Internet public. Quelle option choisir ?",
  "choices": [
    "Azure ExpressRoute",
    "VPN site-à-site sur Internet",
    "Un NSG",
    "Un compte de stockage"
  ]
}
