{
  "id": "l-core-8951bd8d-check-1",
  "schemaVersion": "v2",
  "kind": "public",
  "prompt": "What is the best use of this lesson for D365-SUPPLY-CHAIN-MANAGEMENT-FUNCTIONAL-CONSULTANT-EXPERT preparation?",
  "choices": [
    "Understand role scope and core objectives first",
    "Memorize implementation details without context",
    "Skip product and scenario alignment"
  ]
}
