{
  "id": "dp900-l-sql-managed-instance-check-1",
  "schemaVersion": "v2",
  "kind": "public",
  "prompt": "Une entreprise veut migrer plusieurs bases SQL Server utilisant des fonctions au niveau de l'instance, tout en évitant de gérer le système d'exploitation. Quel service convient le mieux ?",
  "choices": [
    "Azure SQL Database",
    "Azure SQL Managed Instance",
    "SQL Server sur une machine virtuelle Azure",
    "Azure Table Storage"
  ]
}
